{
  "$schema": "https://json-schema.org/draft/2020-12/schema",
  "$id": "https://sage-kernel.dev/schemas/intelligence/runbook.schema.json",
  "title": "Sage Kernel Runbook",
  "type": "object",
  "additionalProperties": false,
  "required": ["id", "title", "risk", "steps", "verification"],
  "properties": {
    "id": { "type": "string", "pattern": "^runbook_[a-z0-9][a-z0-9_-]*$" },
    "title": { "type": "string", "minLength": 1 },
    "risk": { "type": "string", "enum": ["low", "medium", "high", "critical"] },
    "requiresApproval": { "type": "boolean", "default": false },
    "steps": {
      "type": "array",
      "minItems": 1,
      "items": {
        "type": "object",
        "additionalProperties": false,
        "required": ["id", "title", "action"],
        "properties": {
          "id": { "type": "string", "minLength": 1 },
          "title": { "type": "string", "minLength": 1 },
          "action": { "type": "string", "minLength": 1 },
          "command": { "type": "string" },
          "expected": { "type": "string" },
          "timeoutMs": { "type": "integer", "minimum": 1000, "maximum": 300000 },
          "rollback": {
            "type": "object",
            "additionalProperties": false,
            "required": ["description"],
            "properties": {
              "description": { "type": "string", "minLength": 1 },
              "command": { "type": "string", "minLength": 1 }
            }
          }
        }
      }
    },
    "verification": {
      "type": "array",
      "minItems": 1,
      "items": { "type": "string", "minLength": 1 }
    }
  }
}
